{
  "schema_version": "2026-07-03",
  "skill_id": "qveris-news-sentiment-radar",
  "generated_at": "2026-07-03T02:48:30.616Z",
  "mode": "fixture",
  "scope": {
    "ticker": "NVDA",
    "market": "US",
    "window_days": 7,
    "from": "2026-06-25",
    "to": "2026-07-02"
  },
  "findings": [
    "Reviewed NVDA over a 7-day window with 2 QVeris call attempts.",
    "Observed 3 raw records or nested payload rows across selected sources.",
    "Sentiment text mentions in returned payload: 1 positive, 0 negative, 1 neutral.",
    "Use strong labels only when news, filings, or quote reaction agree; otherwise mark the catalyst as weak or unresolved."
  ],
  "evidence": [
    {
      "role": "market_news_sentiment",
      "tool_id": "alphavantage.news_sentiment.query.v1.467a92c0",
      "ok": true,
      "cost": 2,
      "record_count": 2,
      "error": null
    },
    {
      "role": "price_reaction",
      "tool_id": "finnhub_io_api.stock.quote",
      "ok": true,
      "cost": 1,
      "record_count": 1,
      "error": null
    }
  ],
  "risks": [
    "News volume is not the same as market relevance.",
    "Social or insider-sentiment signals need confirmation from filings, reputable news, or price reaction.",
    "Missing provider coverage should be shown explicitly rather than filled by model memory."
  ],
  "usage": {
    "paid_calls": 2,
    "estimated_credits": 3
  },
  "result": {
    "ticker": "NVDA",
    "sentiment_counts": {
      "positive": 1,
      "negative": 0,
      "neutral": 1
    },
    "total_records": 3,
    "signal_level": "positive",
    "catalyst_status": "needs_confirmation",
    "evidence_roles": [
      "market_news_sentiment",
      "price_reaction"
    ],
    "missing_data": []
  }
}