{
  "schema_version": "2026-07-03",
  "skill_id": "qveris-news-sentiment-radar",
  "generated_at": "2026-07-03T09:08:28.351Z",
  "mode": "live",
  "scope": {
    "ticker": "NVDA",
    "market": "US",
    "window_days": 7,
    "from": "2026-06-26",
    "to": "2026-07-03"
  },
  "findings": [
    "Reviewed NVDA over a 7-day window with 6 QVeris call attempts.",
    "Observed 20 raw records or nested payload rows across selected sources.",
    "Sentiment text mentions in returned payload: 32 positive, 38 negative, 11 neutral.",
    "Composite catalyst confidence score is 0.638; scores below 0.65 should stay in watchlist mode.",
    "Use strong labels only when news, filings, or quote reaction agree; otherwise mark the catalyst as weak or unresolved."
  ],
  "evidence": [
    {
      "role": "market_news_sentiment",
      "target": null,
      "tool_id": "alphavantage.news_sentiment.query.v1.467a92c0",
      "ok": true,
      "cost": 2,
      "execution_id": "2b6c4faf-77a5-4bdf-aa70-aeffe435e440",
      "record_count": 8,
      "error": null
    },
    {
      "role": "aggregate_sentiment",
      "target": null,
      "tool_id": "eodhd.sentiments.list.v1.9ba159a0",
      "ok": true,
      "cost": 2.81,
      "execution_id": "f7bf2b69-7660-4c0d-8561-6c0700b87634",
      "record_count": 8,
      "error": null
    },
    {
      "role": "filings_check",
      "target": null,
      "tool_id": "finnhub.stock.filings.retrieve.v1",
      "ok": false,
      "cost": 1,
      "execution_id": "f26dff0f-62d2-49e0-afcb-7d18ccf0b250",
      "record_count": 0,
      "error": null
    },
    {
      "role": "filings_check",
      "target": null,
      "tool_id": "finnhub.stock.filings.retrieve.v1.27aa1125",
      "ok": false,
      "cost": 1,
      "execution_id": "987eb30e-281f-4efc-a9c8-6d8aa3f01af0",
      "record_count": 0,
      "error": null
    },
    {
      "role": "price_reaction",
      "target": null,
      "tool_id": "eodhd.live_data.real_time.retrieve.v1.b60a4285",
      "ok": true,
      "cost": 2.81,
      "execution_id": "2147d444-3593-4932-bea4-2fafffe4d281",
      "record_count": 1,
      "error": null
    },
    {
      "role": "issuer_confirmation",
      "target": null,
      "tool_id": "financialmodelingprep.stable.secfilingscompanysearch.symbol.retrieve.v1.5cf7397d",
      "ok": false,
      "cost": 24.2,
      "execution_id": "ca140d40-6de4-4fa4-81a8-92ad9f029247",
      "record_count": 3,
      "error": null
    }
  ],
  "risks": [
    "News volume is not the same as market relevance.",
    "Social or insider-sentiment signals need confirmation from filings, reputable news, or price reaction.",
    "Missing provider coverage should be shown explicitly rather than filled by model memory."
  ],
  "usage": {
    "paid_calls": 6,
    "estimated_credits": 33.82
  },
  "result": {
    "ticker": "NVDA",
    "sentiment_counts": {
      "positive": 32,
      "negative": 38,
      "neutral": 11
    },
    "total_records": 20,
    "signal_level": "mixed",
    "catalyst_status": "needs_confirmation",
    "catalyst_confidence_score": 0.638,
    "corroborating_roles": [
      "market_news_sentiment",
      "aggregate_sentiment",
      "price_reaction"
    ],
    "confirmation_roles": [],
    "evidence_roles": [
      "market_news_sentiment",
      "aggregate_sentiment",
      "filings_check",
      "filings_check",
      "price_reaction",
      "issuer_confirmation"
    ],
    "missing_data": [
      "filings_or_issuer_confirmation: no filings, issuer-news, or press-release confirmation records returned"
    ]
  }
}