{
  "schema_version": "2026-07-03",
  "skill_id": "qveris-news-sentiment-radar",
  "generated_at": "2026-07-03T06:57:56.480Z",
  "mode": "live",
  "scope": {
    "ticker": "NVDA",
    "market": "US",
    "window_days": 7,
    "from": "2026-06-26",
    "to": "2026-07-03"
  },
  "findings": [
    "Reviewed NVDA over a 7-day window with 5 QVeris call attempts.",
    "Observed 17 raw records or nested payload rows across selected sources.",
    "Sentiment text mentions in returned payload: 26 positive, 42 negative, 13 neutral.",
    "Composite catalyst confidence score is 0.601; scores below 0.65 should stay in watchlist mode.",
    "Use strong labels only when news, filings, or quote reaction agree; otherwise mark the catalyst as weak or unresolved."
  ],
  "evidence": [
    {
      "role": "market_news_sentiment",
      "tool_id": "alphavantage.news_sentiment.query.v1.467a92c0",
      "ok": true,
      "cost": 2,
      "execution_id": "2d9c86b4-eda6-4c81-afba-005b6f6f99eb",
      "record_count": 8,
      "error": null
    },
    {
      "role": "aggregate_sentiment",
      "tool_id": "eodhd.sentiments.list.v1.9ba159a0",
      "ok": true,
      "cost": 2.81,
      "execution_id": "5aedd7ae-ce90-4045-afb8-6521aa63c825",
      "record_count": 8,
      "error": null
    },
    {
      "role": "filings_check",
      "tool_id": "finnhub.stock.filings.retrieve.v1",
      "ok": false,
      "cost": 1,
      "execution_id": "2789fe2a-148e-4946-9a1f-0730d282ac93",
      "record_count": 0,
      "error": null
    },
    {
      "role": "filings_check",
      "tool_id": "finnhub.stock.filings.retrieve.v1.27aa1125",
      "ok": false,
      "cost": 1,
      "execution_id": "feda7e34-4644-4244-ae44-0bdb4934ccad",
      "record_count": 0,
      "error": null
    },
    {
      "role": "price_reaction",
      "tool_id": "eodhd.live_data.real_time.retrieve.v1.b60a4285",
      "ok": true,
      "cost": 2.81,
      "execution_id": "51c7d248-4d5c-4059-952a-561b9369127a",
      "record_count": 1,
      "error": null
    }
  ],
  "risks": [
    "News volume is not the same as market relevance.",
    "Social or insider-sentiment signals need confirmation from filings, reputable news, or price reaction.",
    "Missing provider coverage should be shown explicitly rather than filled by model memory."
  ],
  "usage": {
    "paid_calls": 5,
    "estimated_credits": 9.62
  },
  "result": {
    "ticker": "NVDA",
    "sentiment_counts": {
      "positive": 26,
      "negative": 42,
      "neutral": 13
    },
    "total_records": 17,
    "signal_level": "negative",
    "catalyst_status": "needs_confirmation",
    "catalyst_confidence_score": 0.601,
    "corroborating_roles": [
      "market_news_sentiment",
      "aggregate_sentiment",
      "price_reaction"
    ],
    "evidence_roles": [
      "market_news_sentiment",
      "aggregate_sentiment",
      "filings_check",
      "filings_check",
      "price_reaction"
    ],
    "missing_data": [
      "filings_check: no returned records or provider returned unsuccessful status"
    ]
  }
}